{
  "$schema": "https://json-schema.org/draft/2020-12/schema",
  "$id": "https://quickdraw.local/schemas/bdq-warmup-update-contract.schema.json",
  "title": "QuickDraw production warmup and first-update contract",
  "type": "object",
  "additionalProperties": false,
  "required": [
    "schema_version",
    "task",
    "purpose",
    "base_epsilon_collection_contract",
    "runtime",
    "package",
    "transport",
    "collection",
    "optimization",
    "determinism",
    "exclusions"
  ],
  "properties": {
    "schema_version": {"const": "quickdraw.bdq-warmup-update.v1"},
    "task": {"const": "R3F"},
    "purpose": {"type": "string", "minLength": 1},
    "base_epsilon_collection_contract": {"$ref": "#/$defs/contract_binding"},
    "runtime": {
      "type": "object",
      "additionalProperties": false,
      "required": ["python", "mlagents_envs", "numpy", "torch", "device"],
      "properties": {
        "python": {"const": "3.11.13"},
        "mlagents_envs": {"const": "1.1.0"},
        "numpy": {"const": "1.23.5"},
        "torch": {"const": "2.12.0+cpu"},
        "device": {"const": "cpu"}
      }
    },
    "package": {
      "type": "object",
      "additionalProperties": false,
      "required": ["distribution", "version", "metadata_path", "trainer_entry_points"],
      "properties": {
        "distribution": {"const": "quickdraw-bdq-trainer"},
        "version": {"const": "0.3.0"},
        "metadata_path": {"const": "Research/trainer/pyproject.toml"},
        "trainer_entry_points": {"const": []}
      }
    },
    "transport": {
      "type": "object",
      "additionalProperties": false,
      "required": [
        "api",
        "behavior_name",
        "agent_count",
        "observation_shape",
        "observation_layout",
        "observation_dtype",
        "discrete_branches",
        "transition_completion",
        "truncation_mask_transport",
        "privileged_scene_inference_permitted"
      ],
      "properties": {
        "api": {"const": "mlagents_envs.environment.UnityEnvironment"},
        "behavior_name": {"const": "QuickDrawResearchBasic"},
        "agent_count": {"const": 1},
        "observation_shape": {"const": [84, 84, 4]},
        "observation_layout": {"const": "HWC"},
        "observation_dtype": {"const": "float32"},
        "discrete_branches": {"const": [3, 2]},
        "transition_completion": {"type": "string", "minLength": 1},
        "truncation_mask_transport": {"const": "quickdraw.basic-truncation-mask.v1"},
        "privileged_scene_inference_permitted": {"const": false}
      }
    },
    "collection": {
      "type": "object",
      "additionalProperties": false,
      "required": [
        "scenario_seed",
        "policy_seed",
        "exploration_seed",
        "selector",
        "epsilon",
        "epsilon_decay_enabled",
        "transition_limit",
        "minimum_completed_episodes",
        "minimum_unique_action_tuples",
        "require_no_pending_decision_at_cutoff"
      ],
      "properties": {
        "scenario_seed": {"const": 31001},
        "policy_seed": {"const": 51001},
        "exploration_seed": {"const": 61001},
        "selector": {"const": "seeded_branch_epsilon_greedy"},
        "epsilon": {"const": 1.0},
        "epsilon_decay_enabled": {"const": false},
        "transition_limit": {"const": 10000},
        "minimum_completed_episodes": {"const": 1},
        "minimum_unique_action_tuples": {"const": 6},
        "require_no_pending_decision_at_cutoff": {"const": true}
      }
    },
    "optimization": {
      "type": "object",
      "additionalProperties": false,
      "required": [
        "replay_capacity",
        "replay_warmup_decisions",
        "batch_size",
        "gamma",
        "optimizer",
        "learning_rate",
        "optimizer_update_interval_decisions",
        "hard_target_sync_interval_optimizer_updates",
        "expected_first_update_decision",
        "expected_optimizer_updates",
        "expected_target_synchronizations",
        "require_finite_loss",
        "require_finite_mean_absolute_td_error",
        "require_online_weights_changed",
        "require_target_weights_unchanged"
      ],
      "properties": {
        "replay_capacity": {"const": 100000},
        "replay_warmup_decisions": {"const": 10000},
        "batch_size": {"const": 64},
        "gamma": {"const": 0.99},
        "optimizer": {"const": "Adam"},
        "learning_rate": {"const": 0.0001},
        "optimizer_update_interval_decisions": {"const": 4},
        "hard_target_sync_interval_optimizer_updates": {"const": 10000},
        "expected_first_update_decision": {"const": 10000},
        "expected_optimizer_updates": {"const": 1},
        "expected_target_synchronizations": {"const": 0},
        "require_finite_loss": {"const": true},
        "require_finite_mean_absolute_td_error": {"const": true},
        "require_online_weights_changed": {"const": true},
        "require_target_weights_unchanged": {"const": true}
      }
    },
    "determinism": {
      "type": "object",
      "additionalProperties": false,
      "required": [
        "fresh_processes",
        "exact_trace_equality",
        "torch_num_threads",
        "torch_num_interop_threads",
        "deterministic_algorithms"
      ],
      "properties": {
        "fresh_processes": {"const": 2},
        "exact_trace_equality": {"const": true},
        "torch_num_threads": {"const": 1},
        "torch_num_interop_threads": {"const": 1},
        "deterministic_algorithms": {"const": true}
      }
    },
    "exclusions": {
      "type": "array",
      "minItems": 1,
      "items": {"type": "string", "minLength": 1},
      "uniqueItems": true
    }
  },
  "$defs": {
    "contract_binding": {
      "type": "object",
      "additionalProperties": false,
      "required": ["path", "sha256", "schema_version"],
      "properties": {
        "path": {"const": "Research/trainer/bdq-epsilon-collection-contract-v1.json"},
        "sha256": {"const": "3673e37f20edfcb0f4044b6257fce88d65ff8d56ab09c25166459192cac77f2c"},
        "schema_version": {"const": "quickdraw.bdq-epsilon-collection.v1"}
      }
    }
  }
}
