{
  "schema_version": "quickdraw.bdq-warmup-update.v1",
  "task": "R3F",
  "purpose": "Prove the exact production replay-warmup boundary and one deterministic CPU optimizer update from real Basic Unity transitions without opening a training rollout.",
  "base_epsilon_collection_contract": {
    "path": "Research/trainer/bdq-epsilon-collection-contract-v1.json",
    "sha256": "3673e37f20edfcb0f4044b6257fce88d65ff8d56ab09c25166459192cac77f2c",
    "schema_version": "quickdraw.bdq-epsilon-collection.v1"
  },
  "runtime": {
    "python": "3.11.13",
    "mlagents_envs": "1.1.0",
    "numpy": "1.23.5",
    "torch": "2.12.0+cpu",
    "device": "cpu"
  },
  "package": {
    "distribution": "quickdraw-bdq-trainer",
    "version": "0.3.0",
    "metadata_path": "Research/trainer/pyproject.toml",
    "trainer_entry_points": []
  },
  "transport": {
    "api": "mlagents_envs.environment.UnityEnvironment",
    "behavior_name": "QuickDrawResearchBasic",
    "agent_count": 1,
    "observation_shape": [84, 84, 4],
    "observation_layout": "HWC",
    "observation_dtype": "float32",
    "discrete_branches": [3, 2],
    "transition_completion": "complete the pending action when the same agent next appears in DecisionSteps or TerminalSteps",
    "truncation_mask_transport": "quickdraw.basic-truncation-mask.v1",
    "privileged_scene_inference_permitted": false
  },
  "collection": {
    "scenario_seed": 31001,
    "policy_seed": 51001,
    "exploration_seed": 61001,
    "selector": "seeded_branch_epsilon_greedy",
    "epsilon": 1.0,
    "epsilon_decay_enabled": false,
    "transition_limit": 10000,
    "minimum_completed_episodes": 1,
    "minimum_unique_action_tuples": 6,
    "require_no_pending_decision_at_cutoff": true
  },
  "optimization": {
    "replay_capacity": 100000,
    "replay_warmup_decisions": 10000,
    "batch_size": 64,
    "gamma": 0.99,
    "optimizer": "Adam",
    "learning_rate": 0.0001,
    "optimizer_update_interval_decisions": 4,
    "hard_target_sync_interval_optimizer_updates": 10000,
    "expected_first_update_decision": 10000,
    "expected_optimizer_updates": 1,
    "expected_target_synchronizations": 0,
    "require_finite_loss": true,
    "require_finite_mean_absolute_td_error": true,
    "require_online_weights_changed": true,
    "require_target_weights_unchanged": true
  },
  "determinism": {
    "fresh_processes": 2,
    "exact_trace_equality": true,
    "torch_num_threads": 1,
    "torch_num_interop_threads": 1,
    "deterministic_algorithms": true
  },
  "exclusions": [
    "more than one optimizer update or any extended training rollout",
    "epsilon decay",
    "target-network synchronization",
    "checkpoint, resume, or ONNX export",
    "ROCm execution or training",
    "multi-environment collection",
    "five-seed training or held-out evaluation",
    "learned-policy effectiveness claims",
    "changes to the R2A environment or action contract",
    "gradual-motion Basic variant",
    "strategic combat, reflex, or LLM runtime"
  ]
}
